title,content,cate,rdate
국민의힘 40%·민주당 30.7%...1주 만에 한 자리 격차,"더불어민주당과 국민의힘 정당 지지율 격차가 일주일 만에 다시 한 자릿수 안으로 좁혀졌습니다.YTN이 리얼미터에 의뢰해 진행한 10월 3주차 정당지지율 조사에서 국민의힘은 전주보다 1.2%포인트 하락한 40%의 지지율을 기록했습니다.반면, 더불어민주당 지지율은 전주보다 1.2%포인트 오른 30.7%를 기록하며 한 주 만에 다시 30%대를 회복했습니다.문재인 대통령의 국정수행 평가에서는 긍정 평가가 40%로 전주보다 0.8%포인트 상승했고 부정 평가는 56.7%로 1.5%포인트 하락했습니다.이번 조사는 지난 18일부터 닷새간 전국 만 18세 이상 유권자 2,517명을 상대로 진행됐고 표본오차는 표본오차는 95% 신뢰 수준에 ±2.0%p입니다.자세한 내용은 리얼미터나 중앙선거여론조사심의위원회 홈페이지를 참고하면 됩니다.YTN 김태민 (tmkim@ytn.co.kr)",1,2021-10-25 06:10
국민의힘 지명직 최고위원에 3선 윤영석 의원 임명,"국민의힘 이준석 대표가 공석이었던 지명직 최고위원으로 3선의 윤영석 의원을 임명했습니다.이 대표는 최고위 회의 직후 기자들과 만난 자리에서 합당 논의를 진행했던 국민의당을 배려해 그간 지명직 최고위원 자리를 비워뒀지만, 안철수 대표의 행보를 보면 그런 배려가 가능하지 않은 시점인 것 같다며 이같이 밝혔습니다.또 대선을 앞두고 전반적으로 조직 역량을 강화해야 하는데 윤 의원의 경우 정무적 감각이 있고 대 언론 소통도 원활해 지명하게 됐다고 덧붙였습니다.최고위 시작에 앞서 윤 의원도 국민의힘이 대선에서 이기려면 첫째도 둘째도 단합된 힘이라면서 정권교체를 위해 최고위원으로서 최선을 다하겠다고 밝혔습니다.YTN 황혜경 (whitepaper@ytn.co.kr)",1,2021-10-25 10:08
"'마지막 출근' 이재명 ""맡은 일 다 못해 도민에 죄송...원팀 잘될 것""","더불어민주당 이재명 대선 후보가 경기도 지사직 퇴임을 앞두고 도지사로서 맡은 일을 다 하지 못해 도민에 죄송하게 생각한다고 말했습니다.이 후보는 오늘(25일) 마지막으로 경기도청에 출근하면서 소회를 묻는 취재진 질문에 성남시장 선거도 도지사 선거 때문에 일찍 사퇴해 시민들에 매우 죄송했는데, 경기지사 초선도 8개월여 미리 그만두게 돼 정말 아쉽다면서 이같이 언급했습니다.이낙연 전 대표가 선대위 상임고문을 맡으면서 적극적인 원팀이 될 거라 생각하느냐는 질문에는 이 전 대표가 원팀이 아니라 드림팀이 돼야 한다고 말했다며, 잘 될 것이라고 답했습니다.YTN 송재인 (songji10@ytn.co.kr)",1,2021-10-25 10:08
"국민의힘 ""대장동 TF 확대 개편해 국민검증특위 출범""","국민의힘은 기존의 대장동 TF를 확대 개편해 국민검증특별위원회를 출범시키기로 했습니다.국민의힘 이준석 대표는 김진태 전 의원을 위원장으로 국민검증특위를 구성해 민주당 이재명 대선 후보를 둘러싼 대장동 의혹 제보를 검토하겠다고 밝혔습니다.이와 함께 대표 당선 때부터 강조했던 공직 후보자 역량 강화 TF도 출범시켜, 지방의회를 비롯한 공직 후보자 교육과 추천까지 전반적인 과정을 개선하겠다고 강조했습니다.YTN 김승환 (ksh@ytn.co.kr)",1,2021-10-25 10:07
"北 매체, 한미일 정보 공조에 ""외세추종"" 비난","북한 매체가 한국과 미국, 일본의 정보기관 수장 회동에 대해 '외세 추종'이라고 비난했습니다.북한의 대외 선전매체 '우리민족끼리'는 최근 서울에서 진행된 한미일 정보기관 수장들의 비공개회의를 전하면서 남측이 대북정책에 대한 협조와 지지를 구걸했지만 얻은 것은 없다고 주장했습니다.다른 매체인 '메아리' 역시 남측이 정보공유나 정책조율을 언급하고 있지만 쪽박외교, 청탁외교, 치적쌓기용 외교 등의 평가만 얻고 있다고 깎아내렸습니다.YTN 한연희 (hyheee@ytn.co.kr)",1,2021-10-25 10:06
"북한 매체 ""오징어게임 진짜 주인공은 남한 대선주자들""","북한 선전 매체가 최근 세계적인 인기를 끌고 있는 드라마 '오징어 게임'을 남측의 대선 정국에 빗대면서 대선주자들이 권력 쟁탈전을 벌이고 있다고 비난했습니다.북한 대외 선전매체 '메아리'는 오늘 ""남측 대선 후보들 간의 인신공격과 막말 비난전이 극도에 달하고 각종 비리 의혹을 파헤치며 상대를 물어뜯는 혈투가 벌어지고 있다""며 이같이 전했습니다.이어 ""대선이라는 게임에서 승자가 되기 위해 벌어지는 싸움은 최근 국제사회의 비난과 규탄을 자아내는 드라마 '오징어 게임'의 주인공들도 무색하게 할 정도""라고 주장했습니다.최근 북한 선전 매체들은 '오징어 게임'을 통해 남한의 자본주의 실상이 드러났다고 비난하거나 드라마의 폭력성을 문제삼는 기사들을 잇따라 내놓고 있습니다.YTN 이교준 (kyojoon@ytn.co.kr)",1,2021-10-25 09:59
"민주당·금융위, 가계부채 관리방안 당정협의 개최",더불어민주당과 정부가 내일(26일) 금융당국의 가계부채 관리방안 발표를 앞두고 세부 보완대책을 최종 협의했습니다.국회 정무위 소속 민주당 의원들과 고승범 금융위원장은 오늘 오전 가계부채 관리방안 당정협의를 열었습니다.고승범 금융위원장은 모두발언에서 현재 가계부채의 실물경제 대비 규모나 증가속도가 굉장히 우려스럽고 금융 불균형 심화로 우리 경제의 최대 잠재 위협요인이 될까 걱정한다고 강조했습니다.이어 상환 능력 중심의 대출 관행 정책을 위해 가계부채 내실화 방안을 만들었다며 동시에 취약계층과 실수요자를 보호해 균형감을 최대한 유지하려 했다고 설명했습니다.정무위 여당 간사인 김병욱 의원은 가계부채 규모가 가파르게 증가하면서 우리 경제의 뇌관이 될 수밖에 없다며 취약계층을 중심으로 한 부실 위험 방지 등 연착륙 노력이 필요하다고 말했습니다.YTN 김태민 (tmkim@ytn.co.kr),1,2021-10-25 09:58
"국민의힘, '대장동 특검' 원내대표 원포인트 회담 제안","국민의힘은 대장동 특혜 의혹과 관련한 특별검사 도입을 논의하기 위해 여야 원내대표 원포인트 회담을 열자고 제안했습니다.국민의힘 김기현 원내대표는 지금까지 드러난 정황과 증거만 봐도 대장동 사업은 이재명 후보와 측근이 설계하고 시행했다고 보는 게 당연한 이치지만, 검찰이 몸통 숨기기 수사를 이어가고 있어 특검이 필요하다고 주장했습니다.이어, 특검과 국정조사를 도입해야 한다는 국민 여론이 73%에 이른다면서 특검을 논의하기 위한 원내대표 회담에 응할 것을 더불어민주당에 촉구했습니다.YTN 김승환 (ksh@ytn.co.kr)",1,2021-10-25 09:50
"[황출새]김경진""윤석열, 마지막 토론회 마치고 광주 가서 사과할 것""",,1,2021-10-25 09:31
"국민의힘 ""고장 난 라디오처럼 문 대통령 자화자찬""","국민의힘은 문재인 대통령이 마지막 시정연설까지도 고장 난 라디오처럼 자화자찬만 틀어댔다고 비판했습니다.국민의힘 허은아 수석 대변인은 국민은 먹고 살기 힘들다고 아우성인데, 대통령은 줄줄이 새는 예산에 대해선 사과 한 마디 없이, 재정관리계획도 함구한 채 과거를 미화하기에만 바빴다고 지적했습니다.그러면서 문재인 대통령 임기 내내 국가적 위기의 연속이라고 했지만, 절반 이상은 정권이 만든 것이었다며, 복세편살, '복잡한 세상 편하게 살아가자'는 신조어가 정권의 콘셉트냐고 반문했습니다.이어 다음 정권과 미래 세대에게 책임을 전가하려는 정권의 무책임을, 어느 때보다 철저한 예산 심사로 바로잡겠다고 강조했습니다.YTN 이정미 (smiling37@ytn.co.kr)",1,2021-10-25 10:51
"가계부채 당정협의...""결혼식 등 신용대출 한도 예외""",더불어민주당과 정부가 내일(26일) 금융당국의 가계부채 관리방안 발표를 앞두고 신용대출 한도에 일부 예외를 두는 등 세부 보완대책을 최종 협의했습니다.국회 정무위 소속 민주당 의원들과 고승범 금융위원장은 오늘 오전 가계부채 관리방안 당정협의를 열고 장례식이나 결혼식 같은 불가피한 자금 소요엔 일시적으로 신용대출 한도에 예외를 허용하는 등 실수요자 보호 대책을 논의했습니다.회의에 앞서 고승범 금융위원장은 가계부채가 우리 경제의 최대 잠재 위협요인이 될까 걱정하고 있다며 상환 능력 중심의 대출 관행 정책을 위해 내실화 방안을 만들었다고 설명했습니다.그러면서 이와 동시에 동시에 취약계층과 실수요자를 보호해 균형감을 최대한 유지하려 했다고 설명했습니다.YTN 김태민 (tmkim@ytn.co.kr),1,2021-10-25 10:46
"문 대통령 ""완전한 회복과 국가의 미래 위한 투자""","문재인 대통령은 내년도 예산안 604조 4천억 원에 코로나 위기로부터의 완전한 회복과 국가의 미래를 위한 투자 의지를 담았다고 밝혔습니다.문 대통령은 오늘 국회 시정연설에서 내년 예산은 정부 마지막 예산이자 다음 정부가 사용할 첫 예산이라며 국회의 초당적 협력을 요청했습니다.예산안은 특히, 코로나로부터 국민의 건강과 생명을 지키고 소상공인과 자영업자 등 피해 계층을 두텁게 보호하는 데 최우선을 뒀다고 설명했습니다.또 격차와 불평등을 줄이는 포용적 회복을 이루겠다며, 청년 지원 강화와 지역 간 격차 해소를 강조했습니다.탄소중립 이행과 한국판 뉴딜 사업 추진에 각각 12조 원, 33조7천억 원을 투입하는 등 미래형 경제구조 전환에도 역점을 뒀다고 했습니다.이와 함께 국민의 안전을 지키고 삶의 질을 높이기 위해 국방 예산을 55조 2천억 원으로 늘려 장병 복지와 첨단전력을 확보하고 3대 재난 안전에도 힘쓰겠다고 밝혔습니다.문 대통령은 올해 세수 규모는 예산안 제출 당시보다 확대될 전망이라며, 재정 건전성도 개선할 수 있을 것이라고 기대했습니다.YTN 나연수 (ysna@ytn.co.kr)",1,2021-10-25 10:45
평택 해군 부대 6명 감염...오늘 軍에서 7명 신규 확진,"오늘 군에선 경기도 평택 지역 해군 부대에서 6명이 감염되는 등 7명이 추가 확진돼 누적 확진자가 2,011명으로 늘었습니다.오늘 경기도 평택 지역 해군 2함대 예하 부대에서 간부 4명이 부대 내 확진자 발생에 따라 검사를 받은 결과 양성 판정을 받았고, 병사 2명도 1인 격리 중 확진됐습니다.경남 마산 지역 육군 부대에선 군무원이 민간 확진자의 밀접 접촉자로 통보돼 검사를 받은 결과 양성 판정을 받았습니다.오늘 확진 판정을 받은 7명 전원이 백신 접종 완료 후 2주가 지난 것으로 파악됨에 따라 돌파감염자는 모두 321명으로 늘었습니다.YTN 이승윤 (risungyoon@ytn.co.kr)",1,2021-10-25 10:41
"軍, 모레 故 변희수 하사 '정상 전역'으로 회복","법무부가 고 변희수 하사 사건에 대한 항소포기를 지휘한데 따른 후속조치로, 군 당국은 변 하사의 인사기록을 심신 장애 전역이 아니라 정상 전역으로 변경할 방침입니다.군은 모레(27일) 판결이 확정되는 대로 이를 공식화할 예정입니다.이와 함께 군의 특수성과 사회적 공감대 등을 종합적으로 고려해 관련 법규와 제도에 대해 검토하겠다고 덧붙였습니다.YTN 이승윤 (risungyoon@ytn.co.kr)",1,2021-10-25 10:39
"오영훈 ""이낙연, 선거 진두지휘 역할 맞는 지 고민""","민주당 이낙연 전 대표가 선대위 상임고문직을 수락한 배경엔 선거를 진두지휘하는 역할에 대한 고민이 있었던 것으로 확인됐습니다.이낙연 캠프에서 수석대변인을 맡았던 오영훈 의원은 오늘(25일) 아침 CBS에 출연해 이낙연 전 대표가 당 중심, 후보 중심의 선대위가 구성돼야 효율적으로 운영될 수 있다고 판단했고 상임고문직이 적절하다고 결론 낸 것 같다고 밝혔습니다.이어 이낙연 캠프에 참여했던 의원들에 대해선 선대위 총괄본부장이나, 비서실장 등의 직책과 관련한 이야기가 나왔지만, 실무협의에 맡기기로 했다고 설명했습니다.또 어제 회동 분위기가 조금 서먹했던 건 사실이지만, 허심탄회한 분위기가 연출됐고 충분히 분위기가 좋았다고 덧붙였습니다.YTN 김태민 (tmkim@ytn.co.kr)",1,2021-10-25 10:33
"6·25 전사 4명 유해, 발굴 10여 년만에 신원 확인","10여 년 전 발굴된 6·25 전사자 4명의 신원이 유가족의 유전자 시료를 통해 확인됐습니다.국방부 유해 발굴 감식단은 2009∼2011년 강원 인제·화천·양구와 경북 칠곡 지역에서 발굴한 유해 4구의 신원이 고 송달선 하사와 김시태·정창수·임석호 일병으로 확인됐다고 밝혔습니다.송 하사는 당시 5살이던 아들을 남겨두고 1951년 5월 강원 인제군 북면 용대리 설악산 저항령에서 벌어진 설악산 전투에서, 임 일병은 1951년 8월~10월 사이 치열한 고지전이 전개됐던 백석산 전투에서 각각 전사했습니다.20살에 입대한 김 일병은 1950년 8월 낙동강을 방어했던 경북 칠곡군 다부동 전투에서, 정 일병은 18세 나이에 6사단 소속으로 참전해 1950년 10월 춘천-화천 진격전에서 각각 전사했습니다.2000년 4월 유해 발굴이 시작된 이후 전사자 179명의 신원이 확인됐습니다.YTN 이승윤 (risungyoon@ytn.co.kr)",1,2021-10-25 10:28
"문 대통령, 마지막 시정연설...""일상과 경제회복에 최선""","[앵커]문재인 대통령이 내년도 예산안을 설명하고 남은 임기 국정운영 방안을 설명하는 시정연설을 했습니다.문 대통령은 오늘 시정연설에서 지난 4년 동안 정부의 성과를 강조하고, 남은 임기는 일상과 경제를 회복하는 데 최선을 다하겠다며, 국회의 초당적 협력을 당부했습니다.취재기자 연결해서 자세한 내용 알아보겠습니다. 홍선기 기자!오늘 시정연설이 문재인 대통령의 임기 마지막 시정연설이죠?[기자]네, 오늘 문재인 대통령의 시정연설은 임기 중 여섯 번째로, 마지막 시정연설입니다.문 대통령은 시정연설 앞부분을 지난 4년 동안 이룬 정부의 성과를 강조하는데 할애했습니다.특히, 임기 6개월을 남기고 마지막 시정연설을 하게 돼 감회가 깊다며, 지난 임기 내내 국가적으로 위기의 연속이었다고 말했습니다.취임 초에는 일촉즉발의 한반도 전쟁위기 상황을 극복해야 했고, 일본의 수출규제를 비롯한 보호무역주의 등 급변하는 국제 무역질서에 대응해야 했다고 밝혔습니다.또, 최근에는 코로나 대유행에 맞서 국민의 생명과 안전을 지키는데 모든 역량을 집중해야 했다고 말했습니다.문 대통령은 아직 위기는 끝나지 않았다며 남은 임기는 마지막까지 위기극복에 전념하겠다고 강조했습다.특히, 코로나19로부터 완전한 일상회복과 경제회복을 이루는 데 최선을 다하겠다고 역설했습니다.[앵커]내년 예산안도 위기 극복에 초점을 맞춰서 편성된 점을 강조한 거죠?[기자]네, 문 대통령은 내년도 예산안은 '완전한 회복과 국가의 미래'를 위해 확장적 기조를 유지했다고 설명했습니다.코로나 위기 국면에서 확장재정을 통해 경제와 고용 회복을 선도할 수 있었다는 겁니다.또, 이는 세수확대로 이어져 재정 건전성에도 도움이 되는 선순환 효과를 보여줬다고 밝혔습니다.문 대통령은 그러나 아직 완전한 회복을 위해 가야 할 길이 멀다며, 내년에도 재정의 역할이 클 수밖에 없다며 확장재정의 필요성을 역설했습니다.특히, 코로나로부터 국민의 건강과 생명을 지키고 소상공인과 자영업자 등 피해 계층을 두텁게 보호하는 데 최우선을 뒀다고 설명했습니다.또 격차와 불평등을 줄이는 포용적 회복을 이루겠다며, 청년 지원 강화와 지역 간 격차 해소를 강조했습니다.그러면서, 내년 예산은 이번 정부 마지막 예산이자 다음 정부가 사용할 첫 예산이라며 국회의 초당적 협력을 요청했습니다.지금까지 YTN 홍선기입니다.YTN 홍선기 (sunki0524@ytn.co.kr)",1,2021-10-25 11:11
"文 ""위기극복 전념...완전한 일상·경제회복 위해 최선 다할 것""","문재인 대통령은 마지막까지 위기 극복에 전념해 완전한 일상회복과 경제회복을 이루는 데 최선을 다하겠다고 강조했습니다.문 대통령은 오늘 국회에서 열린 2022년도 예산안 시정연설에서 우리 국민은 위기 때마다 놀라운 역량을 보여주고 나라를 위기에서 구해내 더 강한 대한민국을 만들었다며, 위대한 국민께 무한한 존경과 감사의 말씀을 드린다면서 이같이 말했습니다.또 대한민국은 과거의 대한민국이 아니라며, 방역과 경제회복에서 세계의 모범이 됐고 세계 10위 경제 대국, 수출 6위 무역 강국으로 성장해 명실공히 세계가 인정하는 선진국이 됐다고 설명했습니다.그러면서 이제는 인류 문명이 근본적으로 바뀌는 대전환의 시대를 마주하고 있다며 전 지구적 과제가 된 탄소중립은 우리에게도 국가의 명운이 걸린 중대한 도전이기 때문에 정부는 대전환의 시대를 담대하게 헤쳐나가 새로운 미래를 여는 책임과 역할을 다하겠다고 덧붙였습니다.이와 함께 미래 세대들이 희망을 가질 수 있도록 부동산 문제와 수도권 집중현상, 지역 불균형, 불공정 등 미해결 과제들을 진전시키는데도 전력을 다하고 다음 정부로 노력이 이어지도록 하겠다고도 강조했습니다.YTN 백종규 (jongkyu87@ytn.co.kr)",1,2021-10-25 10:59
"국민의힘 의원들, 대통령 입장할 때 ""특검 수용"" 손팻말 시위","문재인 대통령의 마지막 국회 시정연설에 맞춰 국민의힘 의원들이 국회 본청에서 손팻말 시위를 벌이며 특검 수용을 압박했습니다.국민의힘 의원들은 문 대통령이 국회에 도착하기 전부터 본청에 들어설 때까지 입구 양쪽으로 도열해 플래카드와 손팻말을 들고 특검을 수용하라는 구호를 외쳤습니다.이어, 민주당 의원들이 회의장으로 입장할 때도 로텐더 홀에서도 ""화천대유의 진짜 몸통을 수사하라""거나 ""하명 수사를 사죄하라""고 외치며 시위를 이어갔습니다.문 대통령은 박병석 국회의장의 안내를 받으며 시위에 대해선 별다른 반응 없이 입장했고, 민주당 의원들은 ""돈 받은 자가 범인""이라고 맞대응하기도 했습니다.YTN 이정미 (smiling37@ytn.co.kr)",1,2021-10-25 10:58
"홍준표 ""당선 시 비상경제위 출범·부동산 규제 철폐"" 경제 공약 발표","국민의힘 대권 주자인 홍준표 의원이 비상경제위원회 출범을 골자로 하는 '경제 대개혁' 공약과 부동산 규제 철폐, 공급 확대 방안 등을 담은 부동산 관련 공약을 발표했습니다.홍 의원은 캠프 사무실에서 기자회견을 열고 대통령이 되면 위기대응과 경제 회복을 최우선 과제로 채택하고 당선 즉시 최고의 전문가들을 모아 선제적으로 대응하겠다며 이같이 밝혔습니다.특히 코로나19로 인해 실의에 빠진 서민과 자영업자를 위해 대출상환 추가 유예와 영업 재개 자금 지원, 신용 대사면 등을 통해 조기에 재기할 수 있도록 기회를 제공하겠다고 강조했습니다.또 주거 정책은 임대가 아닌 소유가 기본 정책이 돼야 한다면서 위헌적인 종부세는 폐지해 재산세로 통합하는 등 전체적인 보유세 부담 수준을 경감하겠다고 덧붙였습니다.공약이 다른 후보에 비해 구체적이지 않다는 지적에 대해서는 대통령 선거는 당선될 대통령이 전체적인 국정 지표와 방향만 설정하고 나머지는 전문가가 그 방향에 따라 보완하는 거라면서 후보가 전문가처럼 발표하는 건 부적절하다고 반박했습니다.YTN 황혜경 (whitepaper@ytn.co.kr)",1,2021-10-25 10:52
"김 총리, 최태원 SK 회장과 회동...청년 일자리 논의","김부겸 국무총리와 최태원 SK그룹 회장이 만나 청년 일자리 확대 방안을 논의합니다.김 총리는 오늘 오후 SK하이닉스 이천 캠퍼스에서 최 회장을 만나 '청년희망ON' 프로젝트 협력 방안을 논의할 예정입니다.청년희망ON 프로젝트는 정부가 맞춤형 인재 육성에 필요한 교육비 등을 지원하고 기업은 청년에게 교육 기회를 제공해 미래 인재 육성과 일자리 창출에 협력하는 사업입니다.앞서 KT와 삼성, LG가 동참해 앞으로 3년 동안 모두 8만여 개의 일자리 창출을 약속한 만큼, 최 회장 역시 오늘 김 총리에 청년 고용 확대 계획을 밝힐 것으로 전망됩니다.YTN 나연수 (ysna@ytn.co.kr)",1,2021-10-25 13:02
"원희룡, 이재명 배임·직권남용·위증 혐의로 검찰에 고발","국민의힘 대선 주자인 원희룡 전 제주지사가 더불어민주당 이재명 대선 후보를 배임과 선거법 위반, 직권 남용, 위증 등 18개 혐의로 검찰에 고발했습니다.원희룡 전 제주지사는 대장동 개발 의혹은 물론, 이재명 후보와 관련해 제기된 과거 모든 의혹, 그리고 화천대유 대주주인 김만배 씨 관련 의혹에 대한 고발장을 각각 작성해 대검찰청에 내고, 제보한 내용을 토대로 만든 수사 요구서도 제출했습니다.원 전 지사는, 광범위한 의혹을 하나로 고발할 경우 수사가 지연될 것을 우려해 각각의 혐의를 나눠 고발장을 제출했다면서 관련자들에 대한 조속한 소환 조사를 촉구했습니다.특히, 황무성 전 성남도시개발공사 사장에게 사퇴 압박이 있었던 것으로 드러나고 있는 만큼 이재명 후보가 국정감사장에서 압박한 적이 없다고 말한 것은 위증이라면서, 검찰 수사와 별개로 이재명 후보를 심판하기 위한 청와대 국민청원과 범국민 운동도 벌여나가겠다고 강조했습니다.YTN 이정미 (smiling37@ytn.co.kr)",1,2021-10-25 13:01
"국방부 ""군 간부·병사 두발 규정 개선 추진 중""",국방부는 오늘 간부와 병사의 두발 규정 개선과 관련해 지난 13일 민관군 합동위원회 권고대로 각 군 별로 새로운 두발 규정을 추진하고 있다고 밝혔습니다.부승찬 국방부 대변인은 현재 작전이나 훈련 등 부대별로 서로 다른 임무 특성을 고려해 새로운 규정을 시행할 방침이라며 이같이 전했습니다.이어 두발 규정 개선과 관련해 시행 시점이나 방식은 아직까지 구체적으로 확정된 바 없다고 덧붙였습니다.앞서 민관군 합동위원회는 간부와 병사의 두발 규정 차이는 신분에 따른 차별로 인식된다며 두발 규정을 단일화하되 각 군별 임무 특성을 고려해 시행할 것을 권고했습니다.YTN 김문경 (mkkim@ytn.co.kr),1,2021-10-25 13:00
"통일부 ""교황면담, 평화증진 기회되길...방북성사 지원""","통일부는 오는 29일로 예정된 문재인 대통령의 프란치스코 교황 면담이 한반도 평화 증진을 위해 지혜를 나누는 기회가 되기를 기대한다고 밝혔습니다.이종주 통일부 대변인은 특히 프란치스코 교황의 방북이 성사된다면 한반도 평화 구축에 큰 기여를 할 것이라며 방북이 성사되도록 지원하겠다는 우리 정부 입장을 재확인했습니다.문 대통령의 교황청 방문은 지난 2018년 10월에 이어 두 번째로, 당시 교황은 문 대통령을 만난 자리에서 방북 의사를 밝혔지만 이듬해 하노이 북미정상회담 결렬로 남북관계가 경색되면서 더이상 추진되지 못했습니다.YTN 한연희 (hyheee@ytn.co.kr)",1,2021-10-25 13:00
