title,content,cate,rdate
"사유리, ""아내 대신 엄마가 되었습니다""","[앵커]비혼 출산으로 아들을 얻은 방송인 사유리 씨가 책을 내고 홀로 엄마가 된 과정을 이야기했습니다.무연고자의 장례를 도맡아왔던 장례지도사가 삶과 죽음에 대해 서술한 책도 나왔습니다.새로 나온 책, 김선희 기자입니다.[기자]▶ 아내 대신 엄마가 되었습니다 (사유리 / 다산북스)지난해 11월 정자를 기증받아 아들을 출산한 사유리, 사유리의 비혼출산은 가족의 형태 등 다양한 사회 이슈를 낳기도 했습니다.책에는 홀로 엄마가 되기를 결심하고 그 사실을 밝히기까지 고민이 많았던 복잡한 속내가 자세히 담겨 있습니다.출산과 육아, 사람들의 시선과 편견에 대한 생각과 마음을 특유의 유쾌한 화법으로 풀어냈습니다.[사유리 / 방송인 : 이 책에는 젠과 어떤 식으로 가족이 됐는지 과정이 씌어 있어요. 그래서 관심 있는 분들은 읽어주셨으면 합니다.]▶ 나는 죽음을 돌보는 사람입니다 (강봉희 / 사이드웨이)감염 공포로 코로나 사망자 시신에 손도 대려 하지 않을 때 먼저 병원으로 달려가 시신을 수습했던 한 장례지도사의 이야기입니다.지난 20여 년 동안 7백여 명의 고독사 사망자들과 기초 수급자 고인들의 장례도 아무런 보상 없이 도맡아 왔습니다.저자는 도시 한복판에 납골당이나 공동묘지가 있는 미국처럼 우리도 삶과 죽음을 분리하지 않는 장례문화로 바뀌어야 한다고 강조합니다.▶ 히트의 탄생 (유승재 / 위즈덤하우스)현재 확고한 브랜드로 자리 잡은 한국의 대표 제품들은 어떤 역사를 갖고 있을까.1890년부터 1970년대까지 주요 브랜드의 변천사와 광고, 마케팅, 일상 풍경 등 다양한 이야기를 담았습니다.어렵고 힘든 시절, 불편한 생활을 개선하기 위해 만들어낸 제품이 실제 어떻게 사용됐는지 서민들의 생생한 생활상을 엿볼 수 있습니다.▶ 나의 하루는 명상에서 시작된다 (경서윤 / 설렘)몸과 마음을 치유하는 명상이 왜 우리 몸에 필요한지, 어떻게 시작해야 할지 가르쳐 주는 책입니다.저자는 명상이 나 자신과 마음을 경작하는 정신훈련이라며 명상을 통해 어느 때보다 자신을 이해할 수 있게 된다고 말합니다.또 내가 나의 친절한 친구가 되어 힘들었던 감정을 돌봐줄 수 있게 되면 하루를 따뜻하게 마무리할 수 있다고 조언합니다.YTN 김선희입니다.YTN 김선희 (sunny@ytn.co.kr)",4,2021-10-16 04:10
'불장' 미술 시장...묻지마 투자는 금물,"[앵커]요즘 미술 시장은 그야말로 뜨겁습니다.유동자금이 넘치고, 미술품에 투자하는 이른바 '아트테크'에 눈 뜬 젊은 층이 가세하고 있기 때문인데요.'묻지마 투자'는 미술 시장에서도 금물입니다.이승은 기자가 보도합니다.[기자]국내 최대 미술 장터인 KIAF가 열렸습니다.화랑들은 올해부터 개막 첫날은 최고의 큰손들만 초청하기로 했는데, 문을 열기도 전에 줄을 서는 진풍경이 벌어졌습니다.수억 원에 이르는 대가들의 작품은 물론, 미술 시장 경기의 바로미터인 젊은 작가들의 그림에도 줄줄이 빨간 딱지가 붙었습니다.[주은서 / 20대 컬렉터 : 작가가 살아오신 삶, 그 삶의 의미 또한 그 작품에 다 담겨 있고 그것을 하나하나 분석해나가면서 재미를 또한 느끼고 있기 때문에…]내년 글로벌 미술 장터인 프리즈와 협업을 앞두고 있는 KIAF는 개막 첫날에만 350억 원어치 매출을 올렸습니다.2년 전 나흘간 총매출 310억 원을 껑충 뛰어넘는 수치입니다.[이승민 / 국제갤러리 디렉터 : 저희가 프리뷰 리스트 공유했을 때 예년에 비해서 전화로 문의를 주시는 분들이 많았고요. 특히 이우환 선생님이라든지 하종현 선생님이라든지 단색화 작가들의 작품군에 대한 관심이 높았습니다.]집콕생활의 위안이 될 수 있는 미술품, 취·등록세도 없고 국내 생존작가이거나 6천만 원 미만은 양도세도 없습니다.게다가 젊은 층까지 재테크를 위해 합류하면서 유동자금이 몰리고 있습니다.홈쇼핑 회사의 모바일 라이브 방송에서 판화를 뛰어넘어 수천만 원에 이르는 원화가 팔려나가는 진풍경도 벌어지고 있습니다.전문가들은 미술품은 투자의 가치보다는 향유의 가치가 우선돼야 한다고 강조합니다.[임소정 / 신진작가 지원 아트락페스티벌 홍보 담당 : 그 작가에 대해서 지지하는 컬렉터들이 많아질수록 작가가 더 성장할 수 있고 작품가도 그에 따라서 성장할 수 있다고 믿기 때문입니다.]다양한 미술 장터 방문부터 시작해서 작가를 연구하면서 차분히 접근하는 것이 미술품 수집의 첫발입니다.YTN 이승은입니다.YTN 이승은 (selee@ytn.co.kr)",4,2021-10-16 04:06
빌보드를 국내 차트처럼...K팝 그룹 선전 저력은?,"[앵커]요즘 방탄소년단은 신곡을 냈다 하면 곧바로 빌보드 핫100 정상에 오르는데요,BTS뿐 아니라 다른 K팝 그룹들도 1위까지는 아니어도 빌보드 순위에 자주 오르고 있습니다.이런 성과를 내는 K팝의 저력은 무엇일까요? 김혜은 기자가 보도합니다.[기자]BTS는 지난해 아시아 그룹으로서는 꿈이라고 생각했던 빌보드 핫100 1위를 해냈습니다.그리고 지금까지 모두 6곡, 통산 17주 동안 정상을 차지했습니다.역시 3세대 K팝 그룹인 트와이스 역시 얼마 전 영어 싱글로 83위에 진입했습니다.핫100 차트에 이름을 올리는 K팝 가수가 점차 늘어나고 있는 겁니다.메인 앨범 차트는 더더욱 K팝 잔치입니다.5위권 안에 이름을 올린 그룹들이 갈수록 늘고 있고, 데뷔 3년 이내인 4세대 그룹들도 최근 가파른 성장을 통해 순위에 올랐습니다.이런 성과는 우선, BTS가 미국 음악 시장을 뚫으면서 진입 장벽을 낮춘 요인이 컸습니다.또, 결집력이 강한 K팝 팬덤이 음반이나 음원 등을 적극적으로 구매한 것도 크게 작용했습니다.[김헌식 / 대중문화평론가 : 굉장히 순발력이 있고 결집을 잘하고 확실하게 자신의 팬심을 보이기 위해서 음반뿐 아니라 굿즈 구매라든지 기부, 사회적 활동들을 같이 열정적으로 하는 특징이 있습니다.]실제로 우리나라 CD 시장 규모는 가파르게 성장하면서 지난해 오히려 미국을 앞섰습니다.우리나라가 음반을 수출하는 국가도 아시아 이외 국가로 늘어났는데, 지난해에는 중국보다 미국이 우리 음반을 더 많이 샀습니다.이런 인기에 힘입어 해외 가수들 가운데 K팝 특색을 담은 곡을 발표하거나, 가사나 앨범 제목에 한글을 넣어 적극적으로 K팝 팬들을 겨냥하는 사례도 나오고 있습니다.이런 흐름을 타고 당분간은 미국 시장에서 K팝의 선전이 이어질 것으로 보입니다.다만, 세계 음악 시장에서 K팝이 하나의 장르로 안착할 수 있을 것인지는 또 다른 과제입니다.YTN 김혜은입니다.YTN 김혜은 (henism@ytn.co.kr)",4,2021-10-16 04:01
BTS '에피파니' 뮤직비디오 유튜브 1억뷰 돌파,그룹 방탄소년단의 노래 '에피파니' 뮤직비디오가 유튜브에서 1억 뷰를 돌파하며 또 한 번 기록을 세웠습니다.소속사 빅히트뮤직에 따르면 '에피파니' 뮤직비디오는 어제 오전 11시 43분 기준으로 유튜브 조회 수가 1억 건을 넘어섰습니다.이 곡은 2018년 8월 발매된 리패키지 앨범 '러브 유어셀프 결 앤서'에 수록된 멤버 진의 솔로곡으로 무덤덤하면서도 호소력 있는 보컬이 인상적이라는 평가를 받습니다.이번 기록으로 방탄소년단의 억 단위 조회 수 뮤직비디오는 35편으로 늘었습니다.YTN 김선희 (sunny@ytn.co.kr),4,2021-10-15 14:53
낙찰 순간 파쇄 퍼포먼스... 뱅크시 작품 300억에 팔렸다,"뱅크시의 작품이 낙찰된 지 3년 만에 20배 가까이 오른 가격으로 다시 낙찰됐다.14일, 월스트리트 저널(WSJ)은 런던 소더비 경매에서 뱅크시의 작품 '풍선과 소녀'가 1,870만 파운드, 우리 돈으로 304억 원에 낙찰됐다고 보도했다.풍선과 소녀는 지난 2018년 10월 소더비 경매에서 104만 2천 파운드(16억 9천만 원)에 낙찰된 기록을 갖고 있다. 낙찰 직후 액자 틀 하단에 숨겨놓은 파쇄기가 작동해 작품의 절반을 파쇄해 주목을 받았다.뱅크시는 SNS를 통해 이 퍼포먼스를 자신이 기획했다고 밝힌 바 있다. 처음에는 작품 전체를 파쇄할 생각이었지만 실제로는 절반만 훼손됐다. 원제목인 '풍선과 소녀'에서 '사랑은 쓰레기통에'라는 새 작품명도 생겼다.뱅크시는 ""파괴하고자 하는 욕망도 창조적인 욕구""라는 피카소의 말을 인용해 이 작품을 설명한 바 있다.이번에 낙찰된 작품은 경매에서 팔린 뱅크시 작품 중 최고가를 기록했다. 낙찰자는 아시아의 개인 수집가인 것으로 알려졌다.YTN PLUS 최가영 (weeping07@ytnplus.co.kr)",4,2021-10-15 09:13
"문체부 ""BTS 유엔 공연비 7억 원, 곧 지급 예정""","방탄소년단의 대통령 특사 활동비 미지급 논란에 대해 문화체육관광부가 행정절차가 마무리돼 곧 지급할 예정이라고 밝혔습니다.문체부는 ""BTS의 유엔 공연이 상영돼, 대금 지급 여부는 이미 결정됐다""며 ""후속 행정절차도 마무리돼 곧 대금 7억 원을 지급할 계획""이라고 밝혔습니다.앞서 어제(14일) 열린 해외문화홍보원 국정감사에서 청와대가 BTS 공연비를 아직 지급하지 않은 문제로 공방이 벌어지자, 탁현민 청와대 의전비서관은 SNS를 통해 ""사소한 절차상 지연""이라고 반박했습니다.YTN 김혜은 (henism@ytn.co.kr)",4,2021-10-15 05:05
"문체부 ""BTS 유엔 공연비 7억 원, 곧 지급 예정""","방탄소년단의 대통령 특사 활동비 미지급 논란에 대해 문화체육관광부가 행정절차가 마무리돼 곧 지급할 예정이라고 밝혔습니다.문체부는 ""BTS의 유엔 공연이 상영돼, 대금 지급 여부는 이미 결정됐다""며 ""후속 행정절차도 마무리돼 곧 대금 7억 원을 지급할 계획""이라고 밝혔습니다.앞서 오늘(14일) 열린 해외문화홍보원 국정감사에서 청와대가 BTS 공연비를 아직 지급하지 않은 문제로 공방이 벌어지자, 탁현민 청와대 의전비서관은 SNS를 통해 ""사소한 절차상 지연""이라고 반박했습니다.YTN 김혜은 (henism@ytn.co.kr)",4,2021-10-14 21:48
"""디즈니플러스, 다음 달 12일 한국 서비스 시작""","다음 달 12일 국내 서비스를 시작하는 글로벌 온라인 동영상 서비스 '디즈니플러스'가 미디어 데이 행사를 통해 본격적인 한국 시장 진출을 선언했습니다.'디즈니플러스'는 오늘 온라인 미디어행사를 통해 디즈니, 마블, 픽사, 스타워즈, 내셔널지오그래픽 등 디즈니 핵심 브랜드와 영화·TV 프로그램을 소개했습니다.현재 보유하고 있는 콘텐츠는 '인어공주' '겨울왕국' 등 디즈니 애니메이션과 '어벤져스' 시리즈, 한국에서 제작한 오리지널 콘텐츠 등입니다.'디즈니플러스'는 2019년 11월 처음 출시된 이후 약 2년 만에 1억1천600만 명의 구독자를 모았고, 현재 61개국에서 20개 언어로 서비스를 제공하고 있습니다.국내 구독료는 월 9천900원 또는 연간 9만9천 원이며 모바일 및 태블릿 기기, 스마트 TV, 커넥티드 TV 등 다양한 기기에서 구독할 수 있습니다.계정당 4개 기기에서 동시 접속이 가능하며, 최대 10대의 모바일 디바이스에서 무제한 다운로드가 가능합니다.",4,2021-10-14 18:22
"YTN 탐사보고서 기록, 케이블TV방송대상 '다큐 대상'","YTN의 탐사보도 프로그램인 '탐사보고서 기록'이 케이블TV방송대상, 다큐멘터리 부문 대상을 수상했습니다.한국케이블TV방송협회는 오늘 오후 서울 여의도 콘래드호텔에서 2021(이공이일)케이블TV방송대상 시상식을 개최하고, 부문별 대상을 시상했습니다.부산 형제복지원 사건의 이면을 파헤치고, 대규모 수용시설의 구조적 부조리를 고발한 YTN 탐사보고서 기록,'5공화국의 강제수용소 3부작'이 다큐멘터리 부문 대상을 수상했고, 드라마 부문에서는 OCN의 '경이로운 소문'이, 문화예술교양 부문에서는 tvN '월간 커넥트'가 대상을 받았습니다.이번 시상식은 코로나19 영향으로 무관중 행사로 진행됐으며, 유튜브를 통해 생중계됐습니다.YTN 김웅래 (woongrae@ytn.co.kr)",4,2021-10-14 16:29
온라인 불법복제 3년 새 25% 급증...BTS·어벤져스·원피스 최다,"온라인 동영상 서비스 및 웹툰 시장의 급성장으로 이와 관련한 온라인 불법 복제가 3년 사이 25% 급증한 것으로 나타났습니다.국회 문화체육관광위 이채익 의원이 한국저작권보호원에서 제출받은 자료에 따르면 온라인 불법 복제물에 대한 시정 권고 조치는 지난해 69만4천560건으로 2017년 대비 25.2% 증가했습니다.콘텐츠 분야별로는 방송·영화 등 영상이 전체 64.3%인 182만3천224건으로 가장 많았고 만화 28.1%, 음악 5%, 출판 3% 순이었습니다.특히 영상은 2017년 42만 건에서 지난해 56만 건으로 32.4%, 만화도 4만6천 건에서 7만9천 건으로 70.6% 급증했습니다.단일 콘텐츠로는 일본 만화 '원피스'가 방송 및 만화 분야에서 가장 많이 적발됐고 음악에선 방탄소년단, 영화에선 '어벤져스:인피니티워'가 많이 적발됐습니다.저작권보호원은 2017년부터 올해 8월까지 온라인 불법복제물을 적발해 총 283만7천634건의 시정권고를 내렸습니다.YTN 김선희 (sunny@ytn.co.kr)",4,2021-10-14 14:12
'오징어 게임' 성공에 알리 역 배우 어머니가 보인 반응,"'오징어 게임'에서 이주노동자 알리 압둘 역을 맡은 배우 아누팜 트리파티(32)가 시리즈 성공에 대한 어머니의 반응을 밝혔다.트리파티는 12일 인도 채널 '뉴스18'과 인터뷰를 진행했다. 그는 어머니가 '오징어 게임' 성공에 매우 기뻐하면서도 겸손함을 잃지 말라고 조언했다고 말했다.트리파티는 ""어머니는 상냥한 사람이다. 어머니에게 '엄마 아들이 전 세계에서 질문을 받고 있다'고 말했더니 그녀는 매우 기뻐하며 축하해줬다""고 말했다.그는 이어 ""어머니는 성공에 너무 흥분하지 말고 겸손하라고 얘기했다""며 ""어머니가 제게 가르친 겸손함과 그녀의 양육 방식을 매우 고맙게 생각한다. 오징어 게임의 성공에 가족, 친척들과 나를 아는 사람들이 모두 기뻐하고 있다""고 밝혔다.지금 같은 성공을 예상했냐는 질문에 트리파티는 ""예상한 상황은 아니었다""며 ""쇼가 잘 될거라는 생각은 했지만 이정도까지 돌풍을 일으키리라고는 기대하지 않았다""고 전했다.알리는 인도 출신 배우로 2010년 한국예술종합학교 장학생으로 합격해 한국에 왔다. 그는 '태양의 후예'와 '국제시장' 등 인기 영화와 드라마에 출연했으나 비중 있는 역할을 맡은 것은 '오징어 게임'이 처음이다.13일 넷플릭스는 전 세계 1억 1,100만 가구가 '오징어 게임’을 시청해 해당 시리즈가 '브리저튼'을 제치고 넷플릭스 역대 가장 인기있는 콘텐츠로 등극했다고 전했다.YTN PLUS 정윤주 (younju@ytnplus.co.kr)",4,2021-10-14 08:15
'오징어 게임' 1억천만 구독자 시청...역대 최고 흥행,"세계적인 인기를 끌고 있는 넷플릭스 드라마 '오징어 게임'이 전 세계에서 1억천만 가구가 시청해 역대 최고 흥행작으로 기록됐습니다.넷플릭스는 '오징어 게임'을 시청한 구독 가구가 1억천백만 명을 넘었다며, 28일 만에 8천2백만 구독 가구가 시청한 '브리저튼' 기록을 넘었다고 밝혔습니다.'오징어 게임'은 넷플릭스 비영어권 시리즈 가운데 최초로 21일 연속 1위를 기록하고 있습니다.넷플릭스 측은 ""넷플릭스가 한국에 투자하기 시작한 2015년 당시, 세계적인 수준의 한국 콘텐츠를 선보이는 게 목표였는데, '오징어 게임'이 꿈같은 일을 현실로 만들어줬다""고 밝혔습니다.YTN 김혜은 (henism@ytn.co.kr)",4,2021-10-13 11:57
"""KBS는 왜 '오징어 게임' 못 만드나""...""수위 높아서""","세계적인 인기를 끌고 있는 '오징어 게임'이 KBS 국정감사장에서 콘텐츠 비교 대상으로 거론됐습니다.더불어민주당 조정식 의원은 어제(12일) 열린 국회 과학기술정보방송통신위원회 국정감사에서 양승동 KBS 사장에게 ""'오징어 게임'은 우리 대중문화 위상이 세계적으로 높아진 점을 보여준다""며 ""KBS가 그런 역할을 해야 한다""고 지적했습니다.박성중 국민의힘 의원도 ""KBS는 왜 '오징어 게임'같은 콘텐츠를 생산하지 못하느냐""고 질타했습니다.이에 대해 양승동 사장은 ""'오징어 게임'은 KBS 같은 지상파가 제작할 수 없는 수위의 작품""이라며 ""KBS가 할 수 있는 것을 해야 한다고 생각한다""고 답했습니다.YTN 김혜은 (henism@ytn.co.kr)",4,2021-10-13 11:57
'오징어 게임' 속 초록색 체육복 실제로 나온다,"전 세계적으로 인기를 끌고 있는 넷플릭스 오리지널 시리즈 '오징어 게임' 속 등장 인물들이 입은 초록색 체육복이 실제로 판매된다.13일 온라인 패션 플랫폼 무신사는 '오징어 게임' 속 인물들이 생존 게임에 참가할 때 입는 초록색 체육복과 티셔츠 세트를 추첨 방식으로 한정 판매한다고 밝혔다. 이는 넷플릭스 '오징어 게임' 측이 국내 최초로 공식 협업한 제품이다. 무신사는 핼러윈 데이를 앞두고 드라마 속 게임 참가자 수와 동일하게 체육복 456세트를 제작한다고 설명했다. 체육복 세트 가격도 4만 5,600원이다. 체육복에는 작품 속 주요 캐릭터의 번호인 456, 001, 218, 067 등 네 개 번호가 무작위로 부착될 것으로 보인다.행사 응모 기간은 오는 18일 오전 11시부터 22일 오전 11시까지이며 22일 오후 12시 추첨 결과가 발표된다. 당첨된 이들은 선제작된 초록색 체육복 456세트를 구매할 수 있는 자격을 얻게 된다. 무신사 측은 ""추첨 행사 종료 후 11월 중에는 일반 판매도 예정돼 있다. 자세한 내용과 체육복 사진은 추후 공지하겠다""라고 밝혔다. YTN PLUS 문지영 (moon@ytnplus.co.kr)",4,2021-10-13 11:05
"'오징어 게임' 감독 ""극 중 부자 VIP들, 트럼프와 닮아""","넷플릭스 오리지널 시리즈 '오징어 게임'을 제작한 황동혁 감독이 드라마 속 VIP로 등장하는 부자들 중 한 명이 도널드 트럼프 전 미국 대통령과 닮았다고 밝혔다.황 감독이  지난 10일(현지 시각) 미국 영화 전문 매체 인디 와이어와의 인터뷰를 통해 이같이 밝히면서 미국 언론들도 이를 관심 있게 다루고 있다. 황 감독은 ""트럼프 전 대통령이 오징어 게임의 VIP 중 한 명과 닮았다고 생각한다. 그는 국정을 운영하는 것이 아니라 게임 쇼를 진행하는 듯했고 사람들에게 공포심을 심어주는 것 같았다""라고 말했다.'오징어 게임'은 상금 456억 원을 얻기 위해 참가자들이 벌이는 생존 게임을 그린 드라마다. 여기서 VIP들은 게임 참가자들의 생명에 돈을 걸고 내기를 하는 부도덕한 부자, 권력자 등으로 묘사된다. 황 감독은 ""2008년부터 드라마에 대한 구상을 해왔다""며 ""당시 리먼 브라더스 사태가 있었고 한국 경제도 큰 타격을 받았다. 나 역시 경제적인 어려움을 겪었다""라고 전했다.그러면서 ""지난 10년 동안 많은 문제가 있었다. 전 세계 사람들, 특히 한국의 젊은이들 사이에서는 모든 돈을 가상화폐(암호화폐)에 투자하는 열풍이 불었다""라고 짚었다.이어 황 감독은 ""페이스북, 구글, 한국의 네이버와 같은 IT 거물들이 부상했고 우리 삶을 완전히 바꿔놨다. 이 기업들은 혁신적이지만 또한 부자가 되기도 했다. 이후에는 트럼프가 미국 대통령으로 당선됐다""며 ""이 모든 일이 벌어진 뒤 '오징어 게임'이 세상으로 나올 때가 됐다고 생각했다""고 밝혔다. 그는 ""10년 전만 해도 이 컨셉트는 현실적이지 않았다. 너무 엽기적이어서 사람들은 돈벌이가 안 되는 영화라고 생각했고 폭력적이었기 때문에 타깃 관객도 적었다""며 ""하지만 10년이 흘렀고 넷플릭스 배급 방식이 영화와 달라 제약이 적었기 때문에 나만의 방식으로 만들 수 있었다""라고 덧붙였다.이 인터뷰가 공개되자 미국 폭스 뉴스는 ""세계적인 넷플릭스 히트작의 제작자가 2008년 금융위기와 트럼프 전 대통령의 당선이 드라마에 영감을 줬다고 밝혔다""고 보도했다. 미국 정치 전문 매체 더힐은 ""세계가 이 드라마에 대한 준비가 되었음을 증명하는 데 트럼프 전 대통령이 도움을 줬다""고 설명했다. YTN PLUS 문지영 (moon@ytnplus.co.kr)",4,2021-10-13 09:10
KBS 사장 후보에 임병걸 부사장 등 5명 압축,"KBS 이사회는 오늘 임병걸 현 KBS 부사장 등 5명을 KBS 사장 후보자 면접 대상자로 선정했다고 밝혔습니다.KBS 이사회는 오늘 오후 열린 임시이사회에서 이번 KBS 사장 공모에 지원한 15명을 대상으로 서류심사를 한 결과 후보를 5명으로 압축했습니다.임병걸 부사장을 비롯해 김의철 전 KBS 보도본부장, 서재석 전 KBS 이사, 엄경철 KBS 부산총국장, 이영준 KBS 프로듀서 등 5명이 1차 면접 대상자로 선정됐습니다.KBS 이사회는 오는 15일 임시 이사회에서 1차 면접 심사를 거쳐 3명의 후보자를 선정하며, 이들 3명은 23일 비전 발표회에서 시민참여단의 평가를 받은 뒤 이사회 면접 심사에 임하게 됩니다.이사회 면접에서 최종 후보자 1명을 가린 뒤 27일 대통령에게 임명 제청될 예정입니다.",4,2021-10-12 18:10
"정비석 소설 '자유부인' 시험작 발굴...""설정·내용 유사""","작가 정비석이 한국전쟁 정전 직후인 1954년 발표해 사회적으로 큰 반향을 일으킨 작품 '자유부인'을 내놓기 전에 쓴 시험 작으로 추정되는 소설이 발굴됐습니다.경찰대학 한국경찰사연구원은 '자유부인'과 설정과 내용이 흡사한 시험작 '신박사와 이혼 - 어른을 위한 우화'를 경찰 잡지 '철경'창간호에서 찾아냈다고 밝혔습니다.책의 줄거리는 미국에서 유학한 신박사의 부인 최경옥이 남편 제자와 사랑에 빠져 이혼을 요구했지만 거절당하고, 신박사는 여전히 명성을 유지한다는 내용이라고 경찰대학은 전했습니다.근대문학을 연구하는 이윤정 한국경찰사연구원장은 이런 내용이 1954년 서울신문에 연재되면서 격렬한 논쟁을 불러일으킨 '자유부인'과 비슷하다고 분석했습니다.이 원장은 '신박사와 이혼'과 '자유부인'의 공통점에 대해 ""주요 인물들 간 대화와 그에 대한 논평을 함께 기술하고 있다""며 ""이는 전형적 전지적 작가 시점으로, 작가가 소설 내부 세계와 외부 세계를 모두 다룬다""고 강조했습니다.YTN 김선희 (sunny@ytn.co.kr)",4,2021-10-12 15:42
